child,parent,description_child,description_parent,title,author,isbn,pubname,pubyear
root,,root,,,,,,
e,root,E,root,,,,,
f,root,F,root,,,,,
j,root,J,root,,,,,
ja,j,JA,J,,,,,
jc,j,JC,J,,,,,
jf,j,JF,J,,,,,
jk,j,JK,J,,,,,
jn,j,JN,J,,,,,
jq,j,JQ,J,,,,,
js,j,JS,J,,,,,
jv,j,JV,J,,,,,
jx,j,JX,J,,,,,
jz,j,JZ,J,,,,,
f1029dta,f1000,F1029DTA,F1000,Discovering the Arabian Gulf : Canada's evolving ties with the GCC states ,Robert J Bookmiller,9948432185,Dubai : Gulf Research Center,2006
e1834d,e100,E1834D,E100,444 days : The american hostage story ,Sid Moody and the News Staff and photographers of The Associated Press,0831745703;0831745711,New York : Rutledge Press,1981
e1834d,e100,E1834D,E100,444 days : the hostages remember ,Tim Wells,015132803X;9780151328031,San Diego : Harcourt Brace Jovanovich,1985
jc328abf,jc300,JC328ABF,JC300,A brutal friendship : the West and the Arab elite ,Saïd K Aburish,0575062754;9780575062757,London : Victor Gollancz,1997
e876 avt,e8000,E876 AVT,E8000,A very thin line : the Iran-Contra affairs ,Theodore Draper,0809096137 : $27.95;9780809096138;1855925575;9781855925571,New York : Hill and Wang,1991
jc599avt,jc500,JC599AVT,JC500,A Victory turned sour : human rights in Kuwait since liberation,Theodore Draper,1564320413;9781564320414,New York,1991
jq1852ada,jq1000,JQ1852ADA,JQ1000,Administrative development an Islamic perspective ,Muhammad Al-Buraey,071030059X;9780710300591;0710303335;9780710303332,London ; Boston : KPI ; Boston,1985
e840a&d,e800,E840A&D,E800,Advise & dissent : memoirs of South Dakota and the US Senate ,James G Abourezk,1556520662;9781556520662,Chicago,1989
e183atp,e100,E183ATP,E100,After the Palestine-Israel War : limits to US and Israeli policy ,Khalil Nakhleh and Clifford A Wright,0912031018;9780912031019,Belmont,1983
e183afd,e100,E183AFD,E100,All fall down : America's tragic encounter with Iran,Khalil Nakhleh and Clifford A Wright,0394544889;9780394544885,New York : Random House,1985
e183aae,e100,E183AAE,E100,America and Egypt : from Roosevelt to Eisenhower ,Matthew F Holland,0275954749;9780275954741,Westport,1996
e183ahi,e100,E183AHI,E100,American hostages in Iran the conduct of a crisis,Matthew F Holland,300023332,London : Yale University Press,1985
e183aa,e100,E183AA,E100, Abraham A Ribicoff ; under the editorial direction of Paul H Kreisberg,Warren Christopher [and others] ; with commentaries  Oscar Schachter,American hostages in Iran : the conduct of a crisis ,0300032331;9780300032338,New Haven : Yale University Press
e183apo,e100,E183APO,E100,American public opinion toward Israel and the Arab-Israeli conflict ,Eytan Gilboa,0669134260;9780669134261,Lexington,1987
e184aah,e100,E184AAH,E100,An ancient heritage :the Arab-American minority ,Brent Ashabranner ; photographs  Paul S Conklin,0060200480;9780060200480;0060200499;9780060200497;0397324340;9780397324347;0397324359;9780397324354,New York : HarperCollins,1991
jq1830anc,jq1000,JQ1830ANC,JQ1000,Arab national communism in the Jewish state ,Ilana Kaufman,0813014786;9780813014784,Gainesville,1997
jx1974 e,jx10000,JX1974 E,JX10000, eds,Shai Feldman and Ariel Levite,Arms control and the new Middle East security environment ,9654590115;9789654590112,Jerusalem : Jerusalem Post ; Boulder
f1219a,f1000,F1219A,F1000,Aztec ,written  Elizabeth Baquedano ; photographed  Michel Zabé,0751360198;9780751360196,London : Dorling Kindersley,1993
e184btf,e100,E184BTF,E100,Before the flames : a quest for the history of Arab Americans ,Gregory Orfalea,292707487,Austin : University of Texas Press,1988
jc599btr,jc500,JC599BTR,JC500,Behind the red line : political repression in Sudan ,Human Rights Watch,1564321649;9781564321640,New York : Human Rights Watch,1996
jk468 vt,jk4000,JK468 VT,JK4000,Veil : the secret wars of the CIA 1981-1987 ,Bob Woodward,0671655434;9780671655433,London : Simon & Schuster,1987
e183bwm,e100,E183BWM,E100,Breaking with Moscow ,Arkady N Shevchenko,224028049,London : Cape,1985
e183bc,e100,E183BC,E100,Broken covent : American foreign policy and the crisis between the U.S. and Israel ,Moshe Arens,0671869647;9780671869649,Simon & Schuster,1995
jq1825bc,jq1000,JQ1825BC,JQ1000,Bureaucratic culture : citizens and administrators in Israel ,David Nachmias and David H Rosenbloom,0856647918 : £8.95;9780856647918,London : Croom Helm,1978
jc599bap,jc500,JC599BAP,JC500,By all parties to the conflict : violations of the laws of war in Afghanistan,David Nachmias and David H Rosenbloom,0938579584;9780938579588,New York,1988
e876 j,e8000,E876 J,E8000, Jr,Alexander M Haig,Caveat : realism Reagan and foreign policy ,297785176,London : Weidenfeld and Nicolson
e184cot,e100,E184COT,E100,Children of the roojme : a family's journey ,Elmaz Abinader,0393029522;9780393029529,New York : Norton,1991
jq1825caa,jq1000,JQ1825CAA,JQ1000,Communism and agrarian reform in Iraq ,Rony Gabbay,0856645672;9780856645679,London : Croom Helm,1978
jx1675 cwt,jx10000,JX1675 CWT,JX10000,Contacts with the opposition : a symposium in which 19 distinguished participants discuss experiences in Afghanistan Algeria Angola Cambodia Chile Cyprus Egypt France Greece Iran Iraq Italy Japan Korea Laos Lebanon Mexico Morocco Netherlands Pakistan Peru Philippines Saudi Arabia Spain Taiwan Thailand Turkey USSR Vietnam and Yemen ,edited  Martin F Herz ; foreword  Peter F Krogh,0934742030 : $3.00;9780934742030,Washington : Institute for the Study of Diplomacy,1979
e183bwa,e100,E183BWA,E100,Between Washington and Jerusalem : a reporter's notebook ,Wolf Blitzer,195037081,New York : Oxford University Press,1985
e183df,e100,E183DF,E100,Delta force ,Charlie A Beckwith and Donald Knox,0151246572;9780151246571,San Diego : Harcourt brace jovanovich,1983
jq1850dwd,jq1000,JQ1850DWD,JQ1000,Democracy without democrats? : the renewal of politics in the Muslim world ,edited  Ghassan Salamé,1850437483;9781850437482,London ; New York : IB Tauris Publishers : In the United States of America and Canada distributed by St Martin's Press,1994
jx1662 d,jx10000,JX1662 D,JX10000,Diplomacy ,Henry Kissinger,0671510991;9780671510992;067165991X;9780671659912;0671713663;9780671713669,New York : Simon & Schuster,1994
e748dco,e700,E748DCO,E700,Diplomatic chronicles of the Middle East : a biography of Ambassador Raymond A Hare ,Paul J Hare,0819189359;9780819189356,Lanham,1993
jv7926 1974 di,jv7000000000,JV7926 1974 DI,JV7000000000,Dossier immigration ,Yannie-France Visser,2714200168;9782714200167,Paris : Tema-éditions,1974
e183eai,e100,E183EAI,E100,Eisenhower and Israel : US-Israeli relations 1953-1960 ,Isaac Alteras,0813012058;9780813012056;0813012066;9780813012063,Gainesville : University Press of Florida,1993
ja88eop,ja80,JA88EOP,JA80,Essays on political education ,Bernard Crick and Derek Heater,0815273044;0905273036;9780905273037,Ringmer [England] : Falmer Press,1977
jv6091 ec,jv60000,JV6091 EC,JV60000,Ethnic cleansing ,Andrew Bell-Fialkoff,0333619757;9780333619759,Basingstoke : Macmillan,1996
f317fgc,f300,F317FGC,F300,Florida's gulf coast ,Photographed  Clyde H Smith,0930527186 : $30.00;9780930527181,Old Saybrook,1991
jc571 g,jc5000,JC571 G,JC5000, Genève,Centre international réformé John Knox,Forms of solidarity : Human rights : 14-25 August 1987 ,,Genève : Centre international réformé John Knox
jv8749fti,jv8000,JV8749FTI,JV8000,From time immemorial : The origins of the Arab-Jewish conflict over Palestine ,Joan Peters,0060152656 : $19.95;9780060152659,New York : Harper & Row,1984
e840ghn,e800,E840GHN,E800,General H Norman Schwarzkopf : the autobiography : it doesn't take a hero ,written with Peter Petre,0553089447;9780553089448,New York : Bantam Books,1992
jq224 gab,jq2000,JQ224 GAB,JQ2000,Government and bureaucracy in India 1947-1976 ,BB Misra,0195615972;9780195615975,Delhi ; New York : Oxford University Press,1986
f595gp,f500,F595GP,F500,Great Plains ,Ian Frazier,0374217238;9780374217235,New York : Farrar Straus Giroux,1989
e183got,e100,E183GOT,E100,Guest of the revolution ,Kathryn Koob,0840741057 : $12.95;9780840741059,Nashville : T Nelson Pub,1982
e840j,e800,E840J,E800, Jr,Ben Bradlee,Guts and glory : the rise and fall of Oliver North ,1556110537;9781556110535,New York : DI Fine
e183h,e100,E183H,E100,Hostage ,Sheldon D Engelmayer and Robert J Wagman,0898030846;9780898030846,Ottawa,1981
jc599hri,jc500,JC599HRI,JC500,Human rights in Iraq ,Middle East Watch,0300049595;9780300049596,New Haven ; London : Yale University Press,1990
e183iai,e100,E183IAI,E100,Imagery and ideology in US policy toward Libya 1969-1982 ,Mahmoud G ElWarfally,0822935805;9780822935803,Pittsburgh : University of Pittsburgh Press,1988
jq1825ivi,jq1000,JQ1825IVI,JQ1000,Immigrant voters in Israel : parties and congregations in a local election campaign ,[] Shlomo A Deshen; foreword  Max Gluckman,0719004217;9780719004216,Manchester : Manchester UP,1970
jx1981its,jx1000,JX1981ITS,JX1000,In the service of peace in the Middle East 1967-1979 ,Ensio Siilasvuo,1850651396;9781850651390;0312071515;9780312071516,London : C Hurst ; New York : St Martin's Press,1992
e183iao,e100,E183IAO,E100,Inside and out hostage to Iran hostage to myself,Ensio Siilasvuo,399126457,New York : GP Putnam's Sons,1981
e183wp,e100,E183WP,E100, with Patricia Hass,Richard Queen,Inside and out : hostage to Iran hostage to myself ,399126457,New York : Putnam
jx4541 j,jx40000,JX4541 J,JX40000, Jr,Daoud L Khairallah ; pref  William W Bishop,Insurrection under international law with emphasis on the rights and duties of insurgents ,,Beirut : Lebanese University : Librairie du Liban
jx1907 j,jx10000,JX1907 J,JX10000, Jr,Daoud L Khairallah ; pref  William W Bishop,International Concilation No 550,,New York : Carnegie Endowment for international Peace
jv8760 ima,jv80000,JV8760 IMA,JV80000,International migration and development in the Arab region ,JS Birks and CA Sinclair,922102251X;9789221022510;9221022528;9789221022527;9121022528,Geneva : International Labour Office,1980
e183iia,e100,E183IIA,E100,Iran Israel and the United States : an American foreign policy background study ,Henry Paolucci,0918680441;9780918680440,Whitestone,1991
jq1785imb,jq1000,JQ1785IMB,JQ1000,Iran monarchy bureaucracy & reform under the Qajars 1858-1896 ,Shaul Bakhash,0902729369;0903729369;9780903729369,London : Ithaca Press for the Middle East Centre,1978
f869c;,f800,F869C;,F800, co-editor ; Anita Col,edited  Ron Kelley ; Jonathan Friedlander, associate editor ; photography  Ron Kelley,Irangeles : Iranians in Los Angeles ,0520080084;9780520080089;0520080092;9780520080096
jq1825iad,jq1000,JQ1825IAD,JQ1000,Iraq and democracy : a futuristic perspective ,Reza Rezazadeh,0962903213;9780962903212,Platteville,1993
jc49 iat,jc400,JC49 IAT,JC400,Islam and the modern Muslim world ,GW Choudhury,0905906438;9780905906430,London : Scorpion Pub,1993
jc599ila,jc500,JC599ILA,JC500,Islam liberalism and human rights : implications for international relations ,Katerina Dalacoura,1860643159;9781860643156,London ; New York : IB Tauris,1998
jc49 ima,jc400,JC49 IMA,JC400,Islam Muslims and the modern state : case-studies of Muslims in thirteen countries ,edited  Hussin Mutalib and Taj ul-Islam Hashmi,0333591488;9780333591482;033366969X;9780333669693;031210300X;9780312103002,New York : St Martin's ; Basingstoke : Macmillan,1994
jc49 hae,jc400,JC49 HAE,JC400,Ḥukūmah al-Islāmīyah English+Islamic government ,"Ayatollah Ruhollah Khomeini ; translated  Joint Publications Research Service""",053223166X;9780532231660,New York : Manor Books,1979
jc49 ile,jc400,JC49 ILE,JC400,Islamisme laïcité et droits de l'homme : un siècle de débat sans cesse reporté au sein de la pensée arabe contemporaine ,Mohamed-Chérif Ferjani ; préface d'Ali Merad,2738410251;9782738410252,Paris : Editions L'Harmattan,1991
e183iit,e100,E183IIT,E100,Israel in the mind of America ,Peter Grose,0394516583;9780394516585,New York : Knopf,1983
jq1830 hc,jq10000,JQ1830 HC,JQ10000, Hesi Carmel,Jacques Derogy,Israël ultra-secret ,2221055284;9782221055281,Paris : Éditions Robert Laffont
e184jp,e100,E184JP,E100,Jewish power : inside the American Jewish establishment ,JJ Goldberg,0201327988;9780201327984;0201622424;9780201622423,Reading,1997
f449ka,f400,F449KA,F400,Kentucky : a photographic celebration ,text  Don Edwards ; photographs  William Strode,0938314858;9780938314851;0938314874 : 12.95;9780938314875,Helena,1990
jk468kh,jk400,JK468KH,JK400,Killing hope : US military and CIA interventions since World War II ,William Blum,1567510531;9781567510539;1567510523;9781567510522,Monroe,1995
jc49 lme,jc400,JC49 LME,JC400,L'islam morale et politique ,Mohammed Arkoun,2220026272;9782220026275;9232024098;9789232024091,Paris : Descl de Brouwer,A744
e876 lt,e8000,E876 LT,E8000,Landslide : the unmaking of the president 1984-1988 ,Jane Mayer and dolye McManus,039545185X,Boston : Houghton Mifflin,1988
jq1825lap,jq1000,JQ1825LAP,JQ1000,Legislative and political development : Lebanon 1842-1972 ,Abdo I Baaklini,0822303353;9780822303350,Durham,1976
jc330 lot,jc3000,JC330 LOT,JC3000,Lords of the Lebanese marches : violence and narrative in an Arab society ,Michael Gilsenan,1850430853;9781850430858;1850430993;9781850430995,London ; New York : IB Tauris,1996
e183lfa,e100,E183LFA,E100,Love from America : a newsman's account of efforts to aid hostages in Tehran ,Alex Paen ; written with James H Brown,0915677334;9780915677337,Santa Monica,1989
jc599mwt,jc500,JC599MWT,JC500,Making women talk : the interrogation of Palestinian women security detainees by the Israeli general security services ,Teresa Thornhill ; with a foreword  Geoffrey Bindman,0951961004;9780951961001,London : Lawyers for Palestinian Human Rights,1992
ja82 wt,ja800,JA82 WT,JA800, with the collaboration of Ernest L Fortin,Edited  Ralph Lerner and Muhsin Mahdi,Medieval political philosophy : a sourcebook ,0801491398;9780801491399,Ithaca
e876 gj,e8000,E876 GJ,E8000, George J Mitchell,William S Cohen,Men of zeal : a candid inside story of the Iran-Contra hearings ,0670822523;9780670822522,New York : Viking
jq1825mwr,jq1000,JQ1825MWR,JQ1000,Modernization without revolution  Lebanon's experience,par Edmond Rabbath,0253338700;9780253338709,Bloomington : Indiana University Press,1973
e882mbw,e800,E882MBW,E800,Mr Bush's war : adventures in the politics of illusion ,Stephen R Graubard,1850433666;9781850433668,London : Tauris,1992
jq3396mba,jq3000,JQ3396MBA,JQ3000,Muslim brotherhoods and politics in Senegal ,Lucy C Behrman,0674594908;9780674594906,Cambridge,1970
e183naa,e100,E183NAA,E100,Nasser and American foreign policy 1952-1956 ,Muhammad Abd el-Wahab Sayed-Ahmed,1870326148;9781870326148,London : LAAM,1989
e183nos,e100,E183NOS,E100,Nest of spies : America's journey to disaster in Iran ,Amir Taheri,0091734584;9780091734589,London : Hutchinson,1988
e183nos,e100,E183NOS,E100,Nest of spies : America's journey to disaster in Iran ,Amir Taheri,0394575660 : $19.95;9780394575667,New York : Pantheon Books,1988
jx1974nwa,jx1000,JX1974NWA,JX1000,Nuclear weapons and arms control in the Middle East ,Shai Feldman,0262061899;9780262061896;0262561085;9780262561082,Cambridge,1997
e840o1,e800,E840O1,E800,Obbligato 1939-1979 : notes on a foreign service career ,William H Sullivan,0393018091;9780393018097,New York : Norton,1984
e184oi,e100,E184OI,E100,Occidentalism : images of the West ,edited  James G Carrier,0198279787;9780198279785;0198279795;9780198279792,Oxford : Clarendon Press ; New York : Oxford University Press,1995
jq1825om,jq1000,JQ1825OM,JQ1000,Oil monarchies : domestic and security challenges in the Arab Gulf States ,F Gregory Gause III,0876091516;9780876091517,New York :3b Council On Foreign Relations Press,1993
e183owo,e100,E183OWO,E100,On wings of eagles ,Ken Follett,000217006X;9780002170062,London : Collins,1983
jv8749otg,jv8000,JV8749OTG,JV8000,Open the gates! : A personal story of illegal immigration to Israel ,"[] Ehud Avriel ; preface  Golda Meir""",0297769693;9780297769699,London : Weidenfeld & Nicolson,1975
jv8749rke,jv8000,JV8749RKE,JV8000,Ruaḥ ḳadim English+Operation Babylon ,"Shlomo Hillel ; translated  Ina Friedman""",0385235976;9780385235976,Garden City,1987
jc49 oom,jc400,JC49 OOM,JC400,Origins of modern Arab political thought ,Khaldun S al-Husry,0882060376;9780882060378,Delmar,1980
jq1825ori,jq1000,JQ1825ORI,JQ1000,Ottoman rule in Damascus 1708-1758 ,Karl K Barbir,0691052972;9780691052977,Princeton,1980
e840pam,e800,E840PAM,E800,PS a memoir ,Pierre Salinger,031215187X : $14.95;9780312151874,New York : St Martin's Griffin,1995
jq552pip,jq500,JQ552PIP,JQ500,Pakistan its politics and bureaucracy ,Mustafa Chowdhury,817045025X;9788170450252,New Delhi : Associated Pub House,1988
jx4084pai,jx4000,JX4084PAI,JX4000,Palestine and international law : the legal aspects of the Arab-Israeli conflict,Mustafa Chowdhury,0582780381;9780582780385,[London] : Longman,1974
jx1977pat,jx1000,JX1977PAT,JX1000,Palestine and the United Nations ,Hazem Zaki Nuseibeh,0704322897;9780704322899,New York : Quartet Books,1981
jf274 pac,jf2000,JF274 PAC,JF2000,Patrons and clients in Mediterranean societies ,edited  Ernest Gellner and John Waterbury,0910116997;9780910116992;0715609416;9780715609415,London : Duckworth ; Hanover,1977
jq1758pop,jq1000,JQ1758POP,JQ1000,Patterns of political leadership : Egypt Israel Lebanon ,R Hrair Dekmejian,087395291X;9780873952910;0873952928;9780873952927,Albany : State University of New York Press,1975
e183pwg,e100,E183PWG,E100,Paved with Good Intentions : the American Experience and Iran ,Barry Rubin,0195028058;9780195028058,OUP,1980
e876 ps,e8000,E876 PS,E8000,Perilous statecraft : an insider's account of the Iran-Contra affair ,Michael A Ledeen,0684189941;9780684189949,New York : Scribner,1988
e183pot,e100,E183POT,E100,Pieces of the game : the human drama of Americans held hostage in Iran ,Charles W Scott,0931948517 : $14.95;9780931948510,Atlanta, S26
jc49 pi,jc400,JC49 PI,JC400,Political Islam : religion and politics in the Arab world ,Nazih N Ayubi,0415054427;9780415054423;0415103851;9780415103855,London ; New York : Routledge,1991
jq1825 ppi,jq10000,JQ1825 PPI,JQ10000,Political parties in the West Bank under Jordanian regime 1949-1967 ,Amnon Cohen,0801413214;9780801413216,Ithaca : Cornell University Press,1982
jq1758ppo,jq1000,JQ1758PPO,JQ1000,Political parties of the Middle East and North Africa ,edited  Frank Tachau,0720122368;9780720122367,London : Mansell,1994
jc49 ps,jc400,JC49 PS,JC400,Political science : an Islamic perspective ,Abdul Rashid Moten,0333643119;9780333643112;0312127111;9780312127114,Houndmills,1996
ja84pti,ja80,JA84PTI,JA80,Political trends in the Arab world : the role of ideas and ideals in politics ,Majid Khadduri,0801811228;9780801811227,Baltimore : Johns Hopkins Press,1970
jq3595 pag,jq30000,JQ3595 PAG,JQ30000,Politics and government of revolutionary Libya ,Henri Pierre Habib,0775360104;9780775360103,Montrl : Cercle du livre de France,1975
jc49 haf,jc400,JC49 HAF,JC400,Ḥukūmah al-Islāmīyah French+Pour un gouvernement islamique ,"Ayatollah Seyyed Ruhollah Khomeyni ; traduction M Kotobi et B Simon avec le concours de Ozra Banisadre""",2862210412,Paris : Fayolle,1979
e176pot,e100,E176POT,E100,Presidents of the United States ,Edward Grey,0600560066;9780600560067,London : Hamlyn,1988
e183plc,e100,E183PLC,E100,Promised land; crusader state : the American encounter with the world since 1776 ,Walter A McDougall,0395830850;9780395830857;0395901324;9780395901328,Houghton Mifflin,1998
jq1825rof,jq1000,JQ1825ROF,JQ1000,Republic of fear : the politics of modern Iraq ,Samir al-Khalil,0091740193;9780091740191,London : Hutchinson,1989
jq1850rti,jq1000,JQ1850RTI,JQ1000,Revolutionary transformation in the Arab world : Habash and his comrades from nationalism to Marxism ,Walid W Kazziha,085314237X,London : C Knight,1975
jz3700 rod,jz30000,JZ3700 ROD,JZ30000,Rivers of discord : international water disputes in the Middle East ,Greg Shapland,1850652147;9781850652144,London : Hurst & Co,1997
jq1758rk,jq1000,JQ1758RK,JQ1000, Resat Kasaba,edited  Ellis Goldberg, and Joel Migdal,Rules and rights in the Middle East : democracy law and society ,0295972866;9780295972862;0295972874;9780295972879
e183saa,e100,E183SAA,E100,Saudi Arabia and the United States : birth of a security partnership ,Parker T Hart,0253334608;9780253334602,Bloomington : Indiana University Press,1998
jv8749pmi,jv8000,JV8749PMI,JV8000,Peliṭim menatsḥim imperyah English+Second Exodus : the full story of Jewish illegal immigration to Palestine 1945-1948 ,"Zeʼev Venia Hadari""",085303219X;9780853032199;0853032238;9780853032236,London,1991
jq1758sit,jq1000,JQ1758SIT,JQ1000,Self-determination in the Middle East ,Yosef Gotlieb,0275908089 0030624088 : $30.95;9780275908089;9780030624087;0030624088,New York : Praeger,1982
e876 so,e8000,E876 SO,E8000,Speaking out : the Reagan presidency from inside the White House ,Larry Speakes with Robert Pack,0684189291;9780684189291,New York : Scribner,1988
jn329st,jn300,JN329ST,JN300,Spycatcher : the candid autobiography of a senior intelligence officer ,Peter Wright,0670820555;9780670820559,New York,1987
jq1850ng,jq1000,JQ1850NG,JQ1000, Nicolas Gavrielides ; sponsored  the Joint Committee on the Near and Middle East,edited  Eric Davis, Social Science Research Council, New York City,Statecraft in the Middle East : oil historical memory and popular culture 
jx3091 sii,jx30000,JX3091 SII,JX30000,Studies in international law and diplomatic practice ,Seif Ahmed El-Wady Romahi ; with foreword  William Currie,4828600116 : $24.00;9784828600116,Tokyo : Data Labo,1980
jc599s95 s97su,jc5000000000,JC599S95 S97SU,JC5000000000,Syria unmasked : the suppression of human rights by the Asad regime ,Middle East Watch,0300051158;9780300051155,New Haven : Yale University Press,1991
jx4084tfo,jx4000,JX4084TFO,JX4000,Territorial foundations of the Gulf states ,edited  Richard Schofield,1857281217;9781857281217;1857281225;9781857281224,London : UCL Press,1994
e183tad,e100,E183TAD,E100,Terrorism and democracy ,Stansfield Turner,0395430860;9780395430866,Boston : Houghton Mifflin,1991
e183t$b,e100,E183T$B,E100,The $36 billion bargain : strategy and politics in US assistance to Israel ,AFK Organski,0231071965;9780231071963;0231071973;9780231071970,New York : Columbia Univ Press,1990
jn1129 aho,jn10000,JN1129 AHO,JN10000,A history of the Conservative Party- The Age of Balfour and Baldwin 1902-1940 ,John Ramsden,0582507146;9780582507142,London,1978
e183tah,e100,E183TAH,E100,The American house of Saud : the secret petrodollar connection ,Steven Emerson,0531097781;9780531097786,New York : F Watts,1985
jq1825tag,jq1000,JQ1825TAG,JQ1000,The Arab Gulf states : steps toward political participation ,JE Peterson ; foreword  Majid Khadduri,0275928810;0275928829,New York : Praeger,1988
jq1850taw,jq1000,JQ1850TAW,JQ1000,The Arab world : nation state and democracy ,Fawzy Mansour ; with a contributory chapter  Samir Amin,0862328845;9780862328849;0862328853;9780862328856,Tokyo : United Nations University Press ; London ; Atlantic Highlands,1992
e183tan,e100,E183TAN,E100,The Armageddon network ,Michael P Saba ; edited  Evan Hendricks,0915597071,Vermont : Amana Books,1984
e183tai,e100,E183TAI,E100,The Ayatollah in the cathedral ,Moorhead Kennedy ; with an afterword  Louisa Kennedy,0809027658;9780809027651;0809015331;9780809015337,New York : Hill and Wang,1986
jq1825tba,jq1000,JQ1825TBA,JQ1000,The Baʼth and the creation of modern Syria ,David Roberts,0709942273;9780709942276,London : Croom Helm,1987
jc599tbo,jc500,JC599TBO,JC500,The bedoons of Kuwait : citizens without citizenship ,Human Rights Watch,1564321568,New York : Human Rights Watch,1995
e183tbd,e100,E183TBD,E100,The biggest deal ,Roy Assersohn,413506401,London : Methuen,1982
e183tbs,e100,E183TBS,E100,The broken sword of justice : America Israel and the Palestine tragedy ,[By] Margaret Arakie,0704320223;0704330172;9780704320222;9780704330177,London : Quartet,8.I7
jx1784 tcs,jx10000,JX1784 TCS,JX10000,The Cinderella service  British consuls since 1825 ,DCM Platt,582127408,[London] : Longman,1971
e855 tco,e8000,E855 TCO,E8000,The crises of power : an interpretation of United States foreign policy during the Kissinger Years ,Seyom Brown,0231042647;9780231042642,New York : Columbia University Press,1979
e183tdh,e100,E183TDH,E100,The destined hour : the hostage crisis and one family's ordeal ,Barbara and Barry Rosen with George Feifer,0385178956 : $17.95;9780385178952,Garden City,1982
jz1163 j,jz10000,JZ1163 J,JZ10000, Jr,Chas W Freeman,The diplomat's dictionary ,1878379666;9781878379665,Washington
e840 j,e8000,E840 J,E8000, Jr,Chas W Freeman,The dying dollar empire and the US imperialist conspiracies : real reasons behind: the energy crisis the arab oil boycott shah's proposal for the creation of a fund to assist undeveloped countries,,Sacramento
e183tea,e100,E183TEA,E100,The eagle and the lion : the tragedy of American-Iranian relations ,James A Bill,300040970,New Haven : Yale University Press,1988
jq3831 al,jq30000,JQ3831 AL,JQ30000, Ali Leila,Monte Palmer, El Sayed Yassin,The Egyptian bureaucracy ,0815624557;ZBWT00188255;beiruta06159
ja84teo,ja80,JA84TEO,JA80,The evolution of the Egyptian national image : from its origins to Ahmad Lutfi al-Sayyid ,Charles Wendell,520021118,Berkeley : University of California Press,1972
e183tgo,e100,E183TGO,E100,The game of nations  the amorality of power politics,Charles Wendell,0671205323;9780671205324,New York : Simon and Schuster,1970
jx4521 tgw,jx40000,JX4521 TGW,JX40000,The Gulf War 1990-1991 in international and English law ,edited  Peter Rowe,0415075203;9780415075206,London ; New York,1993
e183tgt,e100,E183TGT,E100,The guts to try : the untold story of the Iran hostage rescue mission by the on-scene desert commander ,James H Kyle with John Robert Eidson,0517577143;9780517577141,New York : Orion Books,1990
