child,parent,description_child,description_parent,title,author,isbn,pubname,pubyear
e876 tit,e8000,E876 TIT,E8000,The Iranian triangle : the untold story of Israel's role in the Iran-Contra affair ,Samuel Segev ; translated  Haim Watzman,0029283418 : $22.50;9780029283417;0020283418,New York : The Free Press,1988
jq1825tir,jq1000,JQ1825TIR,JQ1000,The Iraqi revolution of 1958 : the old social classes revisited ,edited  Robert A Fernea and Wm Roger Louis,1850433186;9781850433187,London ; New York : IB Tauris,1991
jq1830c,jq1000,JQ1830C,JQ1000, compiler,Frank A Clements,The Israeli Secret Services ,1851092250;9781851092253,Oxford
jx1581lpa,jx1000,JX1581LPA,JX1000,Law personalities and politics of the Middle East : essays in honor of Majid Khadduri ,edited  James Piscatori and George S Harris,0916808327;9780916808327,Boulder,1987
jx4422tme,jx4000,JX4422TME,JX4000,The Middle Eastern States and the law of the sea ,Ali A El-Hakim,0719007119 : £19.50;9780719007118,Manchester : Manchester University Press,1979
e29ba,e20,E29BA,E20, Baha Abu-Laban,edited  Earle H Waugh, and Regula B Qureshi,The Muslim community in North America ,0888640331;9780888640338;088864034X;9780888640345;0886640031
jx1954 tnw,jx10000,JX1954 TNW,JX10000,The new world order : a perspective on the post-Cold War era ,Mohamed Rabie,053310033X;9780533100330,New York : Vantage Press,1992
e876 toe,e8000,E876 TOE,E8000,The octopus eagle an inside account of Iranscam,Mohamed Rabie,933703996,Florida : Loiry Publishing House,1987
e876 toe,e8000,E876 TOE,E8000,The octopus eagle : an inside account of Iranscam ,Michael Fredericks,0933703996;9780933703995,Tallahassee,1987
jq1849tos,jq1000,JQ1849TOS,JQ1000,The old social classes and the revolutionary movements of Iraq : a study of Iraq's old landed and commercial classes and of its Communists Baʻthists and Free Officers ,Hanna Batatu,0863565204;9780863565205,London : Saqi,2004
jq1825tos,jq1000,JQ1825TOS,JQ1000,The old social classes and the revolutionary movements of Iraq : a study of Iraq's old landed and commercial classes and of its Communists Ba䨩sts and Free Officers ,Hanna Batatu,0691021988;9780691021980;0691052417;9780691052410,Princeton,1982
e872 tos,e8000,E872 TOS,E8000,The other side of the story ,Jody Powell,0688036465;9780688036461,New York : Morrow,1984
jx4084tow,jx4000,JX4084TOW,JX4000,The other walls : the Arab-Israeli peace process in a global perspective ,Harold H Saunders,0691023379;9780691023373;0691078882;9780691078885;SBBT650963,Princeton,1991
jx4084tpl,jx4000,JX4084TPL,JX4000,The Palestine Liberation Organization : from armed struggle to the Declaration of Independence ,Jamal R Nassar,0275937798;9780275937799,New York : Praeger,1991
e183tpa,e100,E183TPA,E100,The passiote attachment : America's involvement with Israel; 1947 to the present ,George W Ball and Douglas B Ball,0393029336;9780393029338,Norton,1992
jq1825tpo,jq1000,JQ1825TPO,JQ1000,The politics of Israel : the first decade of statehood ,By marver H Bernstein,0837120365;9780837120362,Princeton : Princeton University Press,1957
js7006 tpg,js70000,JS7006 TPG,JS70000,The provincial government of the Mughals 1526-1658 ,[] P Saran,0210226900;9780210226902,New York : Asia Pub House,1973
e840 trw,e8000,E840 TRW,E8000,The real war ,Richard Nixon,044651201X,New York : Warner Books,1980
e183tl,e100,E183TL,E100, Theodore L Eliot,editors, Jr [and others],The Red Army on Pakistan's border : policy implications for the United States ,0080344879;9780080344874
jx1246 tso,jx10000,JX1246 TSO,JX10000,The scourging of Iraq : sanctions law and natural justice ,Geoff Simons,0333654234;9780333654231;0312161824;9780312161828,Houndmills,1996
jq17tsm,jq10,JQ17TSM,JQ10,The secular miracle : religion politics and economic policy in Iran ,Ali Rahnema and Farhad Nomani,0862329388;9780862329389;0862329396;9780862329396,London ; New Jersey : Zed Books,1.A1
jq1825tus,jq1000,JQ1825TUS,JQ1000,The unJewish state : the politics of Jewish identity in Israel ,Akiva Orr,0903729865;9780903729864;0903729857;9780903729857,London : Ithaca Press,.O77
jq3824 tsa,jq30000,JQ3824 TSA,JQ30000,The state and public policies in Egypt since Sadat ,Nazih N Ayubi,0863721311;9780863721311,Reading,1991
e184f,e100,E184F,E100, foreword  Michael Novak,Philip M Kayal and Joseph M Kayal,The Syrian-Lebanese in America  a study in religion and assimilation ,0805784128;9780805784121,[New York] : Twayne Publishers
e876 c;,e8000,E876 C;,E8000, chairman ; Edmund Muskie and Brent Scowcroft,John Tower, members ; introduction  RW Apple," Jr""",Report of the President's Special Review Board+The Tower Commission report : the full text of the President's Special Review Board 
jx1977tun,jx1000,JX1977TUN,JX1000,The United Nations and the Iraq-Kuwait conflict 1990-1996 ,with an introduction  Boutros Boutros-Ghali,9211005965;9789211005967;Sales-Nr.: E 96 I 3,New York : Department of Public Information,1996
e183tus,e100,E183TUS,E100,The United States and the Palestinians ,Mohammed K Shadid,0312833156;9780312833152,New York : St Martin's Press,1981
e183tus,e100,E183TUS,E100,The United States and Iran; 1946-51 : the diplomacy of neglect ,James F Goode,0333471032;9780333471036,Macmillan,1989
e183tus,e100,E183TUS,E100,The United States and Israel : the limits of the special relationship ,Abraham Ben-Zvi,0231081847;9780231081849,Columbia UP,1993
e183tus,e100,E183TUS,E100,The United States and Saudi Arabia : ambivalent allies ,David E Long,0813302080;9780813302089;ZBWT00027332,Boulder : Westview Press,1985
jq559tvo,jq500,JQ559TVO,JQ500,The vanguard of the Islamic revolution : the Jamaʻat-i Islami of Pakistan ,Seyyed Vali Reza Nasr,0520083687;9780520083684;0520083695;9780520083691,Berkeley : University of California Press,1994
jq629tvo,jq600,JQ629TVO,JQ600,The vanguard of the Islamic revolution : the Jamaʻat-i Islami of Pakistan ,Seyyed Vali Reza Nasr,1850438633;9781850438632;1850438641;9781850438649,London ; New York : IB Tauris,1994
jq3898tw1,jq3000,JQ3898TW1,JQ3000,The Wafd 1919-1952 : cornerstone of Egyptian political power ,Janice J Terry,0861990005;9780861990009,London : Third World Centre for Research and Pub,1982
jq1780 tap,jq10000,JQ1780 TAP,JQ10000,Theory and practice in medieval Persian government ,AKS Lambton,0860780678;9780860780670,London : Variorum Reprints,1980
jn1088 tbc,jn10000,JN1088 TBC,JN10000,Trial by conspiracy ,Jonathan Boyd Hunt,0473051230;9780473051235,Auckland ; London : GreeNZone,1998
jk468tot,jk400,JK468TOT,JK400,Trail of the octopus : from Beirut to Lockerbie--inside the DIA ,Donald Goddard with Lester K Coleman,074751562X;9780747515623,London,1993
e814 tai,e8000,E814 TAI,E8000,Truman and Israel ,Michael J Cohen,0520068041;9780520068049,Berkeley : University of California Press,1990
e183ufp,e100,E183UFP,E100,US foreign policy and the shah : building a client state in Iran ,Mark J Gasiorowski,0801424127;9780801424120,Ithaca,1991
jx1705 ug,jx10000,JX1705 UG,JX10000,Uncertain greatness : Henry Kissinger and American foreign policy ,Roger Morris,0704321661;9780704321663,London : Quartet,1977
e840uf,e800,E840UF,E800,Under fire : an American story ,Oliver L North with William Novak,0060183349;9780060183349,New York,1992
jx1977gj,jx1000,JX1977GJ,JX1000, George J Tomeh,editor,United Nations Resolutions on Palestine and the Arab-Israeli conflict 1947-1974 ,,Beirut : Institute for Palestine Studies
e183wwi,e100,E183WWI,E100,Western window in the Arab world ,Leon Borden Blair ; foreword  Mohammed el Fasi,0292700830;9780292700833,Austin : University of Texas Press, F70
jx5419o,jx5000,JX5419O,JX5000, Oslo,testimony given to the Nordic Commission, October 1982,Witness of war crimes in Lebanon ,0863720056;9780863720055
e183wf,e100,E183WF,E100,Witness : from the Shah to the secret arms deal : an insider's account of US involvement in Iran ,Mansur Rafizadeh,0688073697;9780688073695,New York : W Morrow,1987
e840you,e800,E840YOU,E800,Years of upheaval ,Henry Kissinger,718121155,London : Weidenfeld and Nicolson : Michael Joseph,1982
e183yr,e100,E183YR,E100,Yellow ribbon : the secret journal of Bruce Laingen ,L Bruce Laingen,0028810309 : $23.00;9780028810300,Washington : Brassey's (US),1992
f591 bat,f5000,F591 BAT,F5000,Blood and thunder : an epic of the American West ,Hampton Sides,0385507771;9780385507776,New York : Doubleday,2006
e269rc,e200,E269RC,E200,Rough crossings : Britain the slaves and the American Revolution ,Simon Schama,006053916X;9780060539160;9780060539160,New York : Ecco,2006
f1054qc,f1000,F1054QC,F1000,Québec City,Simon Schama,9782894648346;2894648340,Montréal,2009
e842fdi,e800,E842FDI,E800,Four days in November : the assassination of President John F Kennedy ,Vincent Bugliosi,9780393332155;0393332152,New York : WW Norton & Co,2007
jz6385 two,jz60000,JZ6385 TWO,JZ60000,The war of the world : history's age of hatred ,Niall Ferguson,0141013826;9780141013824,London ; New York : Penguin,2007
e169ias,e100,E169IAS,E100,I'm a stranger here myself : notes on returning to America after twenty years away ,Bill Bryson,076790382X;9780767903820,New York : Broadway Books,2000
e118 tlv,e1000,E118 TLV,E1000,The last voyage of Columbus : being the epic tale of the great captain's fourth expedition including accounts of swordfight mutiny shipwreck gold war hurricane and discovery ,Martin Dugard,0316828831;9780316828833,New York : Little,2005
e99hor,e90,E99HOR,E90,House of rain : tracking a vanished civilization across the American Southwest ,Craig Childs,0316608173;9780316608176,New York : Little,2007
f1219cob,f1000,F1219COB,F1000,Cities of blood : voyages through time ,Peter Ackroyd,0756607299;9780756607296,New York,2004
f1219 am,f10000,F1219 AM,F10000,Ancient Mexico : the history and culture of the Maya Aztecs and other pre-Columbian peoples ,Maria Longhena,0760783810;9780760783818,New York : Barnes & Noble Books,2006
jq 1830tjs,jq 0000,JQ 1830TJS,JQ 0000,The Jewish state : a century later ,Alan Dowty,0520209419;9780520209411,Berkeley : University of California Press,1998
e902 e,e9000,E902 E,E9000, editor,Patrick Clawson,How to build a new Iraq after Saddam ,0944029825;9780944029824,Washington
jz 1480 uw,jz 00000,JZ 1480 UW,JZ 00000,Unholy wars : Afghanistan America and international terrorism ,John K Cooley,0745316913;9780745316918;0745316921;9780745316925,London ; Sterling,2000
jv8739 ca,jv80000,JV8739 CA,JV80000,Citizens abroad : emigration and the state in the Middle East and North Africa ,Laurie A Brand,0521858054;9780521858052,Cambridge,2006
jq1841tro,jq1000,JQ1841TRO,JQ1000,The remaking of Saudi Arabia : the struggle between King Saʻud and Crown Prince Faysal 1953-1962 ,Sarah Yizraeli,9652240265;9789652240262,Tel Aviv,1997
e183jtu,e100,E183JTU,E100,Jordan the United States and the Middle East peace process 1974-1991 ,Madiha Rashid Al Madfai,0521415233;9780521415231,Cambridge [England] ; New York,1993
jx238tis,jx200,JX238TIS,JX200,The Iran-United States Claims Tribunal : the first ten years 1981-1991 : an assessment of the tribunal's jurisprudence and its contribution to international arbitration ,Wayne Mapp,0719037905;9780719037900,Manchester ; New York : Manchester University Press ; New York,1993
f1233 abc,f10000,F1233 ABC,F10000,A Black corps d'élite : an Egyptian Sudanese conscript battalion with the French Army in Mexico 1863-1867 and its survivors in subsequent African history ,Richard Hill and Peter Hogg,087013339X;9780870133398,East Lansing : Michigan State University Press,1995
jq1840 ait,jq10000,JQ1840 AIT,JQ10000,All in the family : absolutism revolution and democracy in the Middle Eastern monarchies ,Michael Herb,0791441679;9780791441671;0791441687;9780791441688,Albany : State University of New York Press,1999
e183swt,e100,E183SWT,E100,Sleeping with the devil : how Washington sold our soul for Saudi crude ,Robert Baer,1400050219;9781400050215,New York : Crown,2003
jc49 ipt,jc400,JC49 IPT,JC400,Islamic political thought ,W Montgomery Watt,0748610987;9780748610983,Edinburgh : At the University Press,1998
jc328cwt,jc300,JC328CWT,JC300,Coping with the state : political conflict and crime in the Ottoman Empire 1550-1720 ,Suraiya Faroqhi,9754280762;9789754280760,Istanbul : Isis Press,1995
jc49 tho,jc400,JC49 THO,JC400,The history of Islamic political thought : from the prophet to the present ,Antony Black,0748614710;9780748614714;0748614729;9780748614721,Edinburgh : Edinburgh University Press,2001
jq3898itg,jq3000,JQ3898ITG,JQ3000,In the guise of democracy : governance in contemporary Egypt ,May Kassem ; with a foreword  Raymond Hinnebusch,0863722547;9780863722547,Reading : Ithaca Press,1999
e903 sh,e9000,E903 SH,E9000, Stanley Hauerwas and Frank Lentricchia,special issue editors,Dissent from the homeland : essays after September 11 ,0822365405;9780822365402,Durham
jq3831 tsa,jq30000,JQ3831 TSA,JQ30000,The State and its servants : administration in Egypt from Ottoman times to the present ,edited  Nelly Hanna,9774243641;9789774243646,Cairo,1995
jq1758tas,jq1000,JQ1758TAS,JQ1000,Tribes and state formation in the Middle East ,edited  Philip S Khoury and Joseph Kostiner,0520070798;9780520070790;0520070801;9780520070806;1850432457;9781850432456,Berkeley : University of California Press,1990
e183upt,e100,E183UPT,E100,US policy toward Iraq ,F Gregory Gause III,9948003233;9789948003236,Abu Dhabi,2002
jq1830mp,jq1000,JQ1830MP,JQ1000,Muslim Palestine : the ideology of Ḥamās ,Andrea Nüsse,9057023334;9789057023330;9057023342;9789057023347,Amsterdam : Harwood Academic Publishers,1998
jc49 lat,jc400,JC49 LAT,JC400,Liberalism and the contestation of Islamic sovereignty ,Amr Sabet,9948005139;9789948005131,Abu Dhabi : Emirates Center for Strategic Studies and Research,2003
jv8739 s43wc,jv80000000,JV8739 S43WC,JV80000000, with CH Bleaney & B Al-Najjar,Ian J Seccombe,International migration for employment in the Middle East : an introductory bibliography ,,[Durham] England : University of Durham
jc571 thr,jc5000,JC571 THR,JC5000,The Human rights reader ,edited  Walter Laqueur and Barry Rubin,0452010268;9780452010260,New York : New American Library,1990
ja79 eih,ja700,JA79 EIH,JA700,Ethics in hard times ,edited  Arthur L Caplan and Daniel Callahan,0306407906;9780306407901,New York : Plenum Press,E825
e886 ml,e8000,E886 ML,E8000,My life : the early years V 1 ,Bill Clinton,1400096715;9781400096718,New York : Vintage Books,2005
e840lfa,e800,E840LFA,E800,Lessons from a diplomatic life : watching flowers from horseback ,Marshall P Adair,1442220805;9781442220812,Lanham : Rowman & Littlefield Publishers,2013
jc31 icf,jc300,JC31 ICF,JC300,Imagined communities Français+L'Imaginaire national : réflexions sur l'origine et l'essor du nationalisme ,"Benedict Anderson ; trad de l'anglais par Pierre- Emmanuel Dauzat""",2707125415;9782707125415,Paris : Ed La découverte,1996
jc599bbv,jc500,JC599BBV,JC500,Ben Barka vingt ans après : les droits de l'homme au Maroc,"Benedict Anderson ; trad de l'anglais par Pierre- Emmanuel Dauzat""",2868290191;9782868290199,Paris : Arcantère,1986
jv51 pd,jv500,JV51 PD,JV500,Postcolonial discourses : an anthology ,edited  Gregory Castle,0631210040;9780631210047;0631210059;9780631210054;9780631210954,Oxford UK ; Malden,2001
jv51 dsl,jv500,JV51 DSL,JV500,Discours sur le colonialisme  suivi du Discours sur la négritude ,Aimé Césaire,2708705318;9782708705319,Paris : Présence africaine,2004
jq3198da,jq3000,JQ3198DA,JQ3000,Dangerous alliances : civil society the media and democratic transition in North Africa ,Lise Garon ; foreword  Clovis Demers,1842771604;9781842771600;1842771612;9781842771617,London ; New York : Zed Books,2003
jc381 sds,jc3000,JC381 SDS,JC3000,Structure du sérail English+The sultan's court : European fantasies of the East ,"Alain Grosrichard ; translated  Liz Heron ; with an introduction  Mladen Dolar""",1859848168;9781859848166;1859841228;9781859841228,London ; New York : Verso,1998
jv51 pdc,jv500,JV51 PDC,JV500,Portrait du colonisé précédé de portrait du colonisateur : et d'une préface de Jean-Paul Sartre ,Albert Memmi,2070705501;9782070705504,,1985
jv51 pdc,jv500,JV51 PDC,JV500,Portrait du colonisé English+The colonizer and the colonized ,"Albert Memmi ; [translated from the French  Howard Greenfeld]""",0285647717;9780285647718,,1974
e184oop,e100,E184OOP,E100,Out of place : a memoir ,Edward W Said,1862073708;9781862073708,Granta Books,1999
e885 fot,e8000,E885 FOT,E8000,From Oslo to Iraq and the roadmap ,Edward W Said ; foreword  Tony Judt ; afterword  Wadie E Said,0747573433;9780747573432,London : Bloomsbury,2004
jc93 iia,jc900,JC93 IIA,JC900,Imperial ideology and political thought in Byzantium (1204-1330) ,Dimiter Angelov,0521857031 hardback;9780521857031 hardback,,2007
jc66 an,jc600,JC66 AN,JC600,Arsinoitēs Nomos : administration of the Fayum under Roman Rule ,Tomasz Derda,839182506X;9788391825068,Warsaw : Faculty of Law and Administration of Warsaw University,2006
f1019 f59 nj,f1000000000,F1019 F59 NJ,F1000000000, Jr,[] T Cuyler Young,Excavations at Godin Tepe: first progress report ,,[Toronto] : Royal Ontario Museum
ja84ct,ja80,JA84CT,JA80,China : the political philosophy of the middle kingdom ,Tongdong Bai,9781780320755;1780320752;9781780320762;1780320760,London ; New York : Zed Books,2012
jq3096 ctn,jq30000,JQ3096 CTN,JQ30000,Contesting the Nigerian state : civil society and the contradictions of self-organization ,edited  Mojúbàolú Olúfúnké Okome,9781137324528;113732452X,New York,2005
jn30 ado,jn300,JN30 ADO,JN300,A dictionary of the European Union ,David Phinnemore and Lee McGowan,9781857436839;1857436830;9780203796955,Milton Park,2013
jz5538 dnc,jz50000,JZ5538 DNC,JZ50000,Discourse normative change and the quest for reconciliation in global politics ,Judith Renner,9780719088025;071908802X,Manchester ; New York : Manchester University Press ; New York : Distributed in the US exclusively by Palgrave Macmillan,2013
jf1525cd,jf1000,JF1525CD,JF1000, Centro de Investigación y Docencia Económicas (CIDE),J Ramon Gil-Garcia, Mexico,E-government success factors and measures : theories concepts and methodologies ,9781466640580;1466640588;9781466640597;9781466640603;146664060X
jn40 eec,jn400,JN40 EEC,JN400,Enacting European citizenship ,edited  Engin F Isin and Michael Saward,9781107033962;1107033969,Cambridge : Cambridge University Press,2013
jn33ete,jn30,JN33ETE,JN30,Enlarging the European Union : the commission seeking influence 1961-1973 ,Michael J Geary,9780230302808;0230302807,Houndmills,2013
jz1570ted,jz1000,JZ1570TED,JZ1000,The EU's democracy promotion and the Mediterranean neighbours : orientation ownership and dialogue in Jordan and Turkey ,Ann-Kristin Jonasson,9780415630061;0415630061;9780203759042,Milton Park,2013
jz6369 uo,jz60000,JZ6369 UO,JZ60000, University of Warwick,edited  Bronwen Everill, UK, and Josiah Kaplan, University of Oxford
jn40 pn,jn400,JN40 PN,JN400, Patrizia Nanz,edited  Raphaël Kies,Is Europe listening to us? : successes and failures of EU citizen consultations ,9781409454359;1409454355;9781409454366;9781472400598;1409454363;9781409454366;1472400593;9781472400598,Farnham
jf801 mc,jf8000,JF801 MC,JF8000,Multilevel citizenship ,edited  Willem Maas,9780812245158;0812245156,Philadelphia : University of Pennsylvania Press,2013
jz1318 nag,jz10000,JZ1318 NAG,JZ10000,New age globalization : meaning and metaphors ,Aqueil Ahmad,9781137293411;1137293411,New York,2013
jf799po,jf700,JF799PO,JF700, Professor of Contemporary British Politics and Society,edited  Emmanuelle Avril, Université Sorbonne Nouvelle, France, and Christine Zumello
jf2112at,jf2000,JF2112AT,JF2000, Antonis Theocharous,edited  Kostas Gouliamos, Bruce Newman, Stephan Henneberg,Political marketing : strategic 'campaign culture' 
jq231 pai,jq2000,JQ231 PAI,JQ2000,Public administration in South Asia : India Bangladesh and Pakistan ,edited  Meghna Sabharwal and Evan M Berman,9781439869116;1439869111,Boca Raton,2013
jq231 ppa,jq2000,JQ231 PPA,JQ2000,Public policy and politics in India ,Kuldeep Mathur,9780198077596;0198077599,New Delhi : Oxford University Press,2013
jz1305 aa,jz10000,JZ1305 AA,JZ10000, Amelia Arsenault,edited  RS Zaharna, Ali Fisher,Relational networked and collaborative approaches to public diplomacy : the connective mindshift ,9780415636070;0415636078;9780203082430
jv7590 sbo,jv70000,JV7590 SBO,JV70000,Shifting boundaries of belonging and new migration dynamics in Europe and China ,edited  Ludger Pries,9780230369719;0230369715,Houndmills,2013
jq1769tji,jq1000,JQ1769TJI,JQ1000,Transitional justice in South Asia : a study of Afghanistan and Nepal ,Tazreena Sajjad,9780415629973;0415629977;9780203431375,New York,2013
jf1081 po,jf10000,JF1081 PO,JF10000, Professor of Politics,Dan Hough, University of Sussex, UK,Corruption anti-corruption and governance  
jc479 tdc,jc4000,JC479 TDC,JC4000,The double crisis of the welfare state and what we can do about it ,Peter Taylor-Goo,9781137328106;113732810X;9781137328113;9781137328120,Basingstoke,2013
jv7590 uo,jv70000,JV7590 UO,JV70000, University of Bremen,Christof Roos, Germany,The EU and immigration policies : cracks in the walls of fortress Europe? ,9781137302557;1137302550
jz1318 gcs,jz10000,JZ1318 GCS,JZ10000,Global civil society and transversal hegemony : the globalization-contestation nexus ,Karen M Buckley,9780415698627;0415698626;9780203626580,Milton Park,2013
jz5538 gsm,jz50000,JZ5538 GSM,JZ50000,Globalization social movements and peacebuilding ,edited  Jackie Smith and Ernesto Verdeja,9780815633211;0815633211,Syracuse,2013
jz1318 gtw,jz10000,JZ1318 GTW,JZ10000,Governing the world? : cases in global governance ,edited  Sophie Harman and David Williams,9780415690409;0415690404;9780415690416;0415690412;9780203508398;0203508394,Abingdon,2013
jv305 ias,jv3000,JV305 IAS,JV3000,Irish and Scottish encounters with indigenous peoples : Canada the United States New Zealand and Australia ,edited  Graeme Morton and David A Wilson,0773541500;9780773541504;9780773541511;0773541519,Montreal ; Ithaca : McGill-Queens University Press,2013
jc497 lar,jc4000,JC497 LAR,JC4000,Legitimacy and revolution in a society of masses : Max Weber Antonio Gramsci and the fin-de-siecle debate on social order ,MFN Giglioli,9781412851626;1412851629,New Brunswick,2013
jn36 lit,jn300,JN36 LIT,JN300,Lobbying in the European Union : interest groups lobbying coalitions and policy change ,Heike Klüver,9780199657445;0199657440,Oxford : Oxford University Press,2013
jz1480 mra,jz10000,JZ1480 MRA,JZ10000,Mechanistic realism and US foreign policy : a new framework for analysis ,Johannes Gullestad Rø,9780415635394;041563539X;9780203093498,Milton Park,2013
jv6035 e,jv60000,JV6035 E,JV60000, editor,Huynh Truong Huy,Migration : practices challenges and impact ,9781622576456;1622576454,Hauppauge
jc481 naf,jc4000,JC481 NAF,JC4000,Nazism as Fascism : violence ideology and the ground of consent in Germany 1930-1945 ,Geoff Eley,9780415812627;0415812623;9780415812634;0415812631,Abingdon,2013
jz6374 paa,jz60000,JZ6374 PAA,JZ60000,Political aspirations and perils of security : unpacking the military strategy of the United Nations ,Håkan Edström and Dennis Gyllensporre,9781137008718;1137008717,Houndmills,2013
jn1129poa,jn1000,JN1129POA,JN1000,Portrait of a party : the Conservative Party in Britain 1918-1945 ,Stuart Ball,9780199667987;0199667985,Oxford [UK] : Oxford University Press,2013
jz6385 pw,jz60000,JZ6385 PW,JZ60000,Proxy warfare ,Andrew Mumford,9780745651187;0745651186;9780745651194;0745651194,Cambridge,2013
jz4839 rho,jz40000,JZ4839 RHO,JZ40000,Routledge handbook of international organization ,edited  Bob Reinalda,9780415501439;0415501431;9780203405345;020340534X,Milton Park,2013
jc423 tj,jc4000,JC423 TJ,JC4000, Timothy J Lynch and Nicolas Bouchet,edited  Michael Cox,US foreign policy and democracy promotion ,9780415679794;0415679796;9780415679800;041567980X;9780203550373;0203550374,New York
jn979 sl,jn9000,JN979 SL,JN9000, Senior Lecturer in Modern History,edited  Julie Gottlieb, University of Sheffield and Richard Toye, Professor of Modern History, University of Exeter
jz1308 bit,jz10000,JZ1308 BIT,JZ10000,Being in the world : dialogue and cosmopolis ,Fred Dallmayr,9780813141916;0813141915;9780813141923;9780813141930,Lexington : University Press of Kentucky,2013
jz1305 csa,jz10000,JZ1305 CSA,JZ10000,Class states and international relations : a critical appraisal of Robert Cox and neo-Gramscian theory ,Adrian Budd,9780415681865;0415681863;9780203486733,Milton Park,2013
jz5595 caa,jz50000,JZ5595 CAA,JZ50000,Conflict assessment and peacebuilding planning : toward a participatory approach to human security ,Lisa Schirch,9781565495784;1565495780;9781565495791;1565495799;9781565495807;9781565495814,Boulder,2013
jz1570kp,jz1000,JZ1570KP,JZ1000, Karolina Pomorska and Giselle Bosse editors,Gergana Noutcheva,The EU and its neighbours : values versus security in European foreign policy ,9780719086762;0719086760,Manchester ; New York : Manchester University Press ; New York : Distributed in the US exclusively by Palgrave Macmillan
jn175 dw,jn1000,JN175 DW,JN1000, Dirk Wiemann,edited  Ga Mahlberg,European contexts for English republicanism ,9781409455561;1409455564;9781409455578;1409455572,Farnham
jn13 teo,jn100,JN13 TEO,JN100,The Europeanization of European politics ,edited  Charlotte Bretherton and Michael Mannin,9781137275387;1137275383,New York : Palgrave Macmillan,2013
jz1318 gg,jz10000,JZ1318 GG,JZ10000,Global governance : what? why? whither? ,Thomas G Weiss,9780745660455;0745660452;9780745660462;0745660460,Cambridge,2013
jn318 hes,jn3000,JN318 HES,JN3000,How Europe shapes British public policy  ,Janice Morphet,9781447300465;1447300467,Bristol ; Chicago : Policy Press,2013
jz6300 iic,jz60000,JZ6300 IIC,JZ60000,Improving international capacity development : bright spots ,Jim Armstrong,9781137310101;1137310103,Houndmills,2013
