child,parent,description_child,description_parent,title,author,isbn,pubname,pubyear
jn96ta,jn90,JN96TA,JN90, Timofey Agarin and Alexander Osipov,edited  Karl Cordell,Institutional legacies of communism : change and continuities in minority protection ,9780415638739;0415638739;9780203768914,Milton Park
jz1238ird,jz1000,JZ1238IRD,JZ1000,International relations discipline in France : writing between discipline and state ,Henrik Breitenbauch,9780415630047;0415630045;9780203403167,Milton Park,2013
ja71 mop,ja700,JA71 MOP,JA700,Models of political competence : the evolution of political norms in the works of Burgundian and Habsburg court historians c 1470-1700 ,Maria Golubeva,9789004231054;9004231056;9789004250741,Leiden : Brill,2013
jf1351 paa,jf10000,JF1351 PAA,JF10000,Policy alienation and the power of professionals : confronting new policies ,Lars Tummers,9781781954027;178195402X,Cheltenham,2013
jn12 wu,jn100,JN12 WU,JN100, Washington University,Margit Tavits, St Louis, MO,Post-communist democracies and party organization 
jf1061 psi,jf10000,JF1061 PSI,JF10000,Power sharing in deeply divided places ,edited  Joanne McEvoy and Brendan O'Leary,9780812245011;0812245016,Philadelphia,2013
jc574tpr,jc500,JC574TPR,JC500,The progressive revolution : liberal fascism through the ages Volume II 2009 writings ,Ellis Washington,9780761861119;0761861114;9780761861126,Lanham : University Press of America,2013
jq1828rs,jq1000,JQ1828RS,JQ1000,Reproducing sectarianism : advocacy networks and the politics of civil society in postwar Lebanon ,Paul W T Kingston,9781438447117;1438447116,Albany,2013
jz6009sse,jz6000,JZ6009SSE,JZ6000,Shaping South East Europe's security community for the twenty-first century : trust partnership integration ,edited  Sharyl Cross [and others],9781137010193;1137010193,Basingstoke ; New York : Palgrave Macmillan,2013
jv7633 uat,jv70000,JV7633 UAT,JV70000,Us and them? : the dangerous politics of immigration control ,Bridget Anderson,9780199691593;0199691592,Oxford : Oxford University Press,2013
jc337 nw,jc3000,JC337 NW,JC3000, Nina Witoszek,edited  Lars Trägårdh, and Bron Taylor,Civil society in the age of monitory democracy ,9780857457561;085745756X;9781782381495;178238149X;9780857457578;0857457578;9781782381501;1782381503
jz1570eea,jz1000,JZ1570EEA,JZ1000,EU effectiveness and unity in multilateral negotiations : more than the sum of its parts? ,Louise G van Schaik,1137012544;9781137012548,Hampshire,2013
jq3756fae,jq3000,JQ3756FAE,JQ3000,Federalism and ethnic conflict in Ethiopia : a comparative regional study ,Asnake Kefale,9780415615938;0415615933;9780203759530,Abingdon,2013
jv1060 tga,jv10000,JV1060 TGA,JV10000,The government and administration of Africa 1880-1939 ,edited  Casper Andersen and Andrew Cohen,9781848933187;1848933185,London : Pickering & Chatto,2013
jc251lsa,jc200,JC251LSA,JC200,Leo Strauss and the invasion of Iraq : encountering the abyss ,Aggie Hirst,9780415621625;0415621623;9780203380406,Milton Park,2013
ja71 tla,ja700,JA71 TLA,JA700,The loss and recovery of truth : selected writings ,Gerhart Niemeyer ; edited  Michael Henry,9781587314728;158731472X;9781587314735;1587314738,South Bend,2013
jc311 naw,jc3000,JC311 NAW,JC3000,Nationalism and war ,edited  John A Hall and Siniša Malešević,9781107034754;1107034752;9781107610088;1107610087,Cambridge : Cambridge University Press,2013
jz6009nsc,jz6000,JZ6009NSC,JZ6000,New security challenges in Asia ,edited  Michael Wills and Robert M Hathaway ; in association with The National Bureau of Asian Research,1421410109;9781421410104,Washington,2013
jv6255 jh,jv60000,JV6255 JH,JV60000, Jennifer Hochschild,editors, Harvard University, Jacqueline Chattopadhyay, University of North Carolina at Charlotte
e184pa,e100,E184PA,E100,Puro arte : Filipinos on the stages of empire ,Lucy Mae San Pablo Burns,9780814744437;0814744435;9780814725450;0814725457;9780814708132;0814708137;9780814744499;0814744494,New York University Press,©2012
e267 tmw,e2000,E267 TMW,E2000,The men who lost America : British leadership; the American Revolution; and the fate of the empire ,Andrew Jackson O'Shaughnessy,9780300191073;0300191073,Yale University Press,2013
e183 as,e1000,E183 AS,E1000,American speeches.,Scott Farris,1931082979;9781931082976;1931082987;9781931082983,Distributed to the trade in the United States by Penguin Putm; Library of America,2006
e185lor,e100,E185LOR,E100,Long old road : back to Black metropolis ,Horace R Cayton,9781412811217;141281121X,Transaction Publishers,2010
e184ca,e100,E184CA,E100,Coming apart : the state of white America; 1960-2010 ,Charles Murray,9780307453426;0307453421;9780307453440;0307453448,Crown Forum,2012
e185cc,e100,E185CC,E100,Colored cosmopolitanism : the shared struggle for freedom in the United States and India ,Nico Slate,9780674059672;0674059670,Harvard University Press,2012
e183ra,e100,E183RA,E100,Rethinking anti-Americanism : the history of an exceptiol concept in American foreign relations ,Max Paul Friedman,9780521864916;0521864917;9780521683425;0521683424,Cambridge University Press,2012
e159 bit,e1000,E159 BIT,E1000,Born in the U.S.A. : birth; commemoration; and American public memory ,edited  Seth C Bruggeman,9781558499386;1558499385;9781558499379;1558499377,University of Massachusetts Press,2012
e169tai,e100,E169TAI,E100,The American intellectual tradition.,edited  David A Hollinger and Charles Capper,9780195392920;0195392922;9780195392937;0195392930,Oxford University Press,2011
e175vft,e100,E175VFT,E100,Views from the dark side of American history ,Michael Fellman,9780807139028;0807139025;9780807139035;0807139033;9780807139042;0807139041;9780807139059;080713905X,Louisia State University Press,2011
e164 tcr,e1000,E164 TCR,E1000,The cultural roots of American Islamicism ,Timothy Marr,0521852935;052161807X;9780521852937;9780521618076,Cambridge University Press,2006
e185fst,e100,E185FST,E100,From sit-ins to SNCC : the student civil rights movement in the 1960s ,edited  Iwan Morgan and Philip Davies,9780813041513;0813041511;40021226068,University Press of Florida,2012
e184maj,e100,E184MAJ,E100,Muslims and Jews in America : commolities; contentions; and complexities ,edited  Reza Aslan and Aaron J Hahn Tapper,9780230108608;0230108601;9780230108615;023010861X,Palgrave Macmillan,2011
e185ri,e100,E185RI,E100,Racial innocence : performing American childhood from slavery to civil rights ,Robin Bernstein,9780814787076;081478707X;9780814787083;0814787088;9780814787090;0814787096;9780814789780;0814789781,New York University Press,2011
e185sff,e100,E185SFF,E100,Sojourning for freedom : black women; American communism; and the making of black left feminism ,Erik S McDuffie,9780822350330;0822350335;9780822350507;0822350505,Duke University Press,2011
e185lbb,e100,E185LBB,E100,Louisia beyond black and white : new interpretations of twentieth-century race and race relations ,edited  Michael S Martin ; foreword  Adam Fairclough,9781935754046;1935754041;40019383435,University of Louisia at Lafayette Press,2011
e185mga,e100,E185MGA,E100,Marcus Garvey and the vision of Africa ,edited  John Hendrik Clarke with the assistance of Amy Jacques Garvey ; [new introduction  Runoki Rashidi],9781574780475;1574780476,Black Classic Press,2011
e185bfa,e100,E185BFA,E100,Beyond forty acres and a mule : African American landowning families since Reconstruction ,edited  Debra A Reid and Evan P Bennett ; foreword  Loren Schweninger,9780813039862;081303986X;40021084274,University Press of Florida,2012
jn30 ed,jn300,JN30 ED,JN300,European disunion : between sovereignty and solidarity ,edited  Jack Hayward and Rüdiger Wurzel,9780230367739;0230367739,Palgrave Macmillan,2012
e185tla,e100,E185TLA,E100,To live an antislavery life : persol politics and the antebellum Black middle class ,Erica L Ball,9780820329765;0820329762;9780820343501;0820343501;40021501170,University of Georgia Press,2012
e183poe,e100,E183POE,E100,Patterns of empire : the British and American empires; 1688 to the present ,Julian Go,9781107011830;1107011833;9781107600782;1107600782,Cambridge University Press,2011
e175mma,e100,E175MMA,E100,Museums; monuments; and tiol parks : toward a new genealogy of public history ,Denise D Meringolo,9781558499409;1558499407;9781558499393;1558499393;40021149849,University of Massachusetts Press,2012
e185tmo,e100,E185TMO,E100,The myth of post-racial America : searching for equality in the age of materialism ,H Roy Kaplan,9781610480055;1610480058;9781610480062;1610480066;9781610480079;1610480074,Rowman & Littlefield Education,2011
e185nio,e100,E185NIO,E100,Not in our lifetimes : the future of black politics ,Michael C Dawson,9780226138626;0226138623,University of Chicago Press,2011
e184aa,e100,E184AA,E100,Arab America : gender; cultural politics; and activism ,Nadine Naber,9780814758861;081475886X;9780814758878;0814758878;9780814758885;0814758886;9780814759202;0814759203,New York University Press,2012
e183ufp,e100,E183UFP,E100,US foreign policy and Iran ,Donette Murray,9780415394062;0415394066;9780415581394;0415581397;9780203874431;0203874439,Routledge,2010
e744 tra,e7000,E744 TRA,E7000,The rise and decline of the American 'Empire' : power and its limits in comparative perspective ,Geir Lundestad,9780199646104;0199646104,Oxford University Press,2012
e185oat,e100,E185OAT,E100,Obama and the biracial factor : the battle for a new American majority ,edited  Andrew J Jolivette,9781447301011;1447301013;9781447301004;1447301005,Policy,2012
e183tkq,e100,E183TKQ,E100,The Kurdish question in U.S. foreign policy : a documentary sourcebook ,[compiled ] Lokman I Meho,0313314357;9780313314353,Praeger,2004
e184baa,e100,E184BAA,E100,Between Arab and White : race and ethnicity in the early Syrian American diaspora ,Sarah MA Gualtieri,9780520255326;0520255321;9780520255340;0520255348,University of California Press,2009
e185cwc,e100,E185CWC,E100,Cold War civil rights : race and the image of American democracy ,Mary L Dudziak,9780691152431;0691152438,Princeton University Press,2011
e169tad,e100,E169TAD,E100,The American dream : a cultural history ,Lawrence R Samuel,9780815610076;0815610076;40021346724,Syracuse University Press,2012
e185wwb,e100,E185WWB,E100,We will be satisfied with nothing less : the African American struggle for equal rights in the North during Reconstruction ,Hugh Davis,9780801450099;0801450098,Cornell University Press,2011
e185str,e100,E185STR,E100,Seeing through race : a reinterpretation of civil rights photography ,Martin A Berger ; foreword  David J Garrow,9780520268630;0520268636;9780520268647;0520268644,University of California Press,2011
e169hwf,e100,E169HWF,E100,How we forgot the Cold War : a historical journey across America ,Jon Wiener,9780520271418;0520271416;40021346615,University of California Press,2012
e183tka,e100,E183TKA,E100,The Kurds and US foreign policy : intertiol relations in the Middle East since 1945 ,Marianna Charountaki,9780415587532;0415587530;9780203842614;0203842618,Routledge,2011
e185iia,e100,E185IIA,E100,Imprisoned in a luminous glare : photography and the African American freedom struggle ,Leigh Renee Raiford,9780807834305;0807834300;40018873781,University of North Caroli Press,2011
e185itc,e100,E185ITC,E100,In the cause of freedom : radical Black intertiolism from Harlem to London; 1917-1939 ,Minkah Makalani,9780807835043;0807835048,University of North Caroli Press,2011
e185dbt,e100,E185DBT,E100,Death blow to Jim Crow : the tiol Negro Congress and the rise of militant civil rights ,Erik S Gellman,9780807835319;0807835315,University of North Caroli Press,2012
e183tfw,e100,E183TFW,E100,The French way : how France embraced and rejected American values and power ,Richard F Kuisel,9780691151816;0691151814,Princeton University Press,2012
e185w,e100,E185W,E100,Writings ,"WEB Du Bois""",094045033X;0521324823;9780940450332,Library of America,1986
e185pra,e100,E185PRA,E100,Paul Robeson and the Cold War performance complex : race; madness; activism ,Tony Perucci,9780472071685;0472071688;9780472051687;0472051687;9780472028207;0472028200,Eurospan distributor; University of Michigan Press,2012
e184oop,e100,E184OOP,E100,Out of place : a memoir ,Edward W Said,1862070113;9781862070110,Granta Books,1999
e185tv,e100,E185TV,E100,Troubling vision : performance; visuality; and blackness ,Nicole R Fleetwood,9780226253022;9780226253039;0226253023;0226253031,The University of Chicago Press,2011
e169tmi,e100,E169TMI,E100,The machine in the garden : technology and the pastoral ideal in America ,Leo Marx,0195133501;9780195133509;019513351X;9780195133516,Oxford University Press,2000
e183eaa,e100,E183EAA,E100,Evangelicals and American foreign policy ,Mark R Amstutz,9780199987634;0199987637;9780199987641;9780199987658,Oxford University Press,2014
e185atu,e100,E185ATU,E100,A tion under our feet : black political struggles in the rural South from slavery to the great migration ,Steven Hahn,0674011694;9780674011694;067401765X;9780674017658,Belkp,2003
e185atu,e100,E185ATU,E100,A tion under our feet : black political struggles in the rural South from slavery to the great migration ,Steven Hahn,0674011694;9780674011694;067401765X;9780674017658,Belkp,2005
e183pop,e100,E183POP,E100,Perceptions of Palestine : their influence on U.S. Middle East policy ,Kathleen Christison,0520217187;9780520217188,University of California Press,1999
e169dad,e100,E169DAD,E100,Disciplirity and dissent in cultural studies ,edited  Cary Nelson and Dilip Parameshwar Gaonkar,0415913713;0415913721,Routledge,1996
e169mca,e100,E169MCA,E100,Mass culture and everyday life ,edited  Peter Gibian,0415916747;0415916755,Routledge,1996
e184mfw,e100,E184MFW,E100,My father's wars : migration; memory; and the violence of a century ,Alisse Waterston,9780415859172;0415859174;9780415859189;0415859182;9780203798744,Routledge,2014
e185aho,e100,E185AHO,E100,A history of prejudice : race; caste; and difference in India and the United States ,Gyanendra Pandey,9781107029002;1107029007;9781107609389;1107609380,Cambridge University Press,2013
e184cdi,e100,E184CDI,E100,Cultural diversity in the United States ,edited  Larry L Naylor,9780897894784;0897894782;9780897894791;0897894790,Bergin & Garvey,1997
e169pm,e100,E169PM,E100,Prosthetic memory : the transformation of American remembrance in the age of mass culture ,Alison Landsberg,0231129262;0231129270,Columbia University Press,2004
e184caa,e100,E184CAA,E100,Chinese Americans and their immigrant parents : conflict; identity; and values ,May Paomay Tung,0789010550;0789010569,Haworth Clinical Practice Press,2000
e184amr,e100,E184AMR,E100,American mixed race : the culture of microdiversity ,edited  Naomi Zack,0847680126;0847680134,Rowman & Littlefield,1995
e169tpp,e100,E169TPP,E100,The postmodern presence : readings on postmodernism in American culture and society ,edited  Arthur Asa Berger,076198979X;0761989803,AltaMira P,1998
e169ttd,e100,E169TTD,E100,The terror dream : myth and misogyny in an insecure America ,Susan Faludi,9780312428006;0312428006,Picador,2008
e185rca,e100,E185RCA,E100,Race; culture; and the intellectuals : 1940-1970 ,Richard H King,9780801880650;0801880653;9780801880667;0801880661,Johns Hopkins University Press; Woodrow Wilson Center Press,2004
e164 tro,e1000,E164 TRO,E1000,The reshaping of everyday life; 1790-1840 ,Jack Larkin,0060916060;9780060916060;0060159057;9780060159054,HarperPerennial,1989
e184ls,e100,E184LS,E100,La storia : five centuries of the Italian American experience; 1492-1992 ,Jerre Mangione & Ben Morreale,0060924411,HarperCollins Publishers,1992
e184bt,e100,E184BT,E100,Brown : the last discovery of America ,Richard Rodriguez,0142000795,Viking,2002
f152 ita,f1000,F152 ITA,F1000,Into the American woods : negotiators on the Pennsylvania frontier ,James H Merrell,0393046761;0393319768,Norton,1999
e210 olo,e2000,E210 OLO,E2000,Our lives; our fortunes and our sacred honor : the forging of American independence; 1774-1776 ,Richard R Beeman,9780465026296;046502629X;9780465037827;0465037828,Basic Books A Member of the Perseus Books Group,2013
e188 ac,e1000,E188 AC,E1000,American colonies ,Alan Taylor ; [map illustrations  Jeffrey Ward],9780142002100;0142002100,Penguin,2002
e178 gml,e1000,E178 GML,E1000,Give me liberty! : An American history ,Eric Foner,9780393934304;0393934306,WW Norton,2011
e191 tby,e1000,E191 TBY,E1000,The barbarous years : the peopling of British North America : the conflict of civilizations; 1600-1675 ,Bernard Bailyn,9780394515700;0394515706,Alfred A Knopf,2012
e178 ooo,e1000,E178 OOO,E1000,Out of our past : the forces that shaped modern America ,Carl N Degler,0061319856;9780061319853,Harper & Row,1984
e169aia,e100,E169AIA,E100,Anti-intellectualism in American life ,Richard Hofstadter,0394703170,Vintage Books,1963
e188 gii,e1000,E188 GII,E1000,Great issues in American history ,edited  Clarence L  Ver Steeg and Richard Hofstadter,0394705408;9780394705408,Vintage Books,1969
e183ara,e100,E183ARA,E100,America; Russia; and the Cold War; 1945-2006 ,Walter LaFeber,9780073534664;0073534668,McGraw-Hill,2008
e169afg,e100,E169AFG,E100,A field guide to getting lost ,Rebecca Solnit,0143037242,Penguin,2006
e188tpo,e100,E188TPO,E100,The peopling of British North America : an introduction ,Joseph C Morton,0394757793,Vintage Books,1988
e178 tph,e1000,E178 TPH,E1000,The Penguin history of the United States of America ,Hugh Brogan,014025255X,Penguin,2001
e302rc,e300,E302RC,E300,Revolutiory characters : what made the founders different ,Gordon S Wood,1594200939;9781594200939;9780143112082;0143112082,Penguin Press,2007
e169tgd,e100,E169TGD,E100,The Great Depression in America : a cultural encyclopedia.,William H Young and Nancy K Young,0313335206;9780313335204;0313335214;9780313335211;0313335222;9780313335228,Harcourt Education distributor; Greenwood,2007
e169tgd,e100,E169TGD,E100,The Great Depression in America : a cultural encyclopedia.,William H Young and Nancy K Young,0313335206;9780313335204;0313335214;9780313335211;0313335222;9780313335228,Harcourt Education distributor; Greenwood,2007
e169tlo,e100,E169TLO,E100,The life of the mind in America : from the Revolution to the Civil War ,Perry Miller,0156519909,Harcourt,1965
e178 tgo,e1000,E178 TGO,E1000,The growth of the American republic ,Samuel Eliot Morison and Henry Steele Commager,0195025954;9780195025958;0195025938;9780195025934;0195025946;9780195025941,OUP,1980
e178 tgo,e1000,E178 TGO,E1000,The growth of the American republic ,Samuel Eliot Morison and Henry Steele Commager,0195025954;9780195025958;0195025938;9780195025934;0195025946;9780195025941,OUP,1980
e112 ah,e1000,E112 AH,E1000,American holocaust : the conquest of the New World ,David E  Stannard,9780195085570;0195085574,Oxford University press,1992
e183saf,e100,E183SAF,E100,Support any friend : Kennedy's Middle East and the making of the U.S.-Israel alliance ,Warren Bass,9780195165807;0195165802;9780195177503,Oxford University Press,2004
e185tso,e100,E185TSO,E100,The shadow of the panther : Huey Newton and the price of Black power in America ,Hugh Pearson,9780201483413;0201483416,Addison-Wesley,1994
e183 sa,e1000,E183 SA,E1000,Self-rule : a cultural history of American democracy ,Robert H Wiebe,0226895629;9780226895628;9780226895635;0226895637,U of Chicago P,1995
e184tce,e100,E184TCE,E100,The Chinese experience in America ,Shih-shan Henry Tsai,0253313597;0253203872,India UP,1986
e185tao,e100,E185TAO,E100,The autobiography of Malcolm X ,with the assistance of Alex Haley ; foreword  Attallah Shabazz ; introduction  MS Handler ; epilogue  Alex Haley ; afterword  Ossie Davis,9780345350688;0345350685;9780606003674;0606003673;9780812419535,Ballantine,1999
e185blm,e100,E185BLM,E100,Black like me ,John Howard Griffin,9780451234216;0451234219,Signet,2010
e169ts,e100,E169TS,E100,The seventies : the great shift in American culture; society; and politics ,Bruce J Schulman,030681126X,Da Capo,2002
e185rt,e100,E185RT,E100,Redemption : the last battle of the Civil War ,Nicholas Lemann,9780374530693;0374530696,Farrar Straus and Giroux,2007
e183fts,e100,E183FTS,E100,For the soul of mankind : the United States; the Soviet Union; and the Cold War ,Melvyn P Leffler,9780809097173;0809097176;9780374531423;0374531420,Hill and Wang,2007
e206 fol,e2000,E206 FOL,E2000,Friends of liberty : Thomas Jefferson; Tadeusz Kościuszko; and Agrippa Hull : a tale of three patriots; two revolutions; and a tragic betrayal of freedom in the new tion ,Gary B Nash and Graham Russell Gao Hodges,9780465048144;0465048145;9780465031481;046503148X,Basic Books,2008
e302tbt,e300,E302TBT,E300,To begin the world anew : the genius and ambiguities of the American founders ,Bernard Bailyn,0375713085;9780375713088,Vintage,2004
e183dt,e100,E183DT,E100,Dangerous tion ,Robert Kagan,0375724915;9780375724916,Knopf,2006
e184wtw,e100,E184WTW,E100,Working toward whiteness : how America's immigrants became white : the strange journey from Ellis Island to the suburbs ,David R  Roediger,9780465070749;0465070744,Perseus Running distributor; BasicBooks,2006
e185coa,e100,E185COA,E100,Coming of age in Mississippi ,Anne Moody,9.78039E+12,Delta Trade Paperbacks,2004
e185sba,e100,E185SBA,E100,Slavery by another me : the re-enslavement of Black Americans from the Civil War to World War II ,Douglas A Blackmon,9780385722704;0385722702,Anchor Books,2009
e302tro,e300,E302TRO,E300,The rise of American democracy : Jefferson to Lincoln ,Sean Wilentz,9780393058208;0393058204,Norton,2005
e184wwb,e100,E184WWB,E100,We won't budge : an African exile in the world ,Manthia Diawara,046501710X;9780465017102,BasicBooks,2004
e175hot,e100,E175HOT,E100,Historians of the American frontier : a bio-bibliographical sourcebook ,edited  John R Wunder,0313248990,Greenwood P,1988
e199 eof,e1000,E199 EOF,E1000,Empire of fortune : crowns; colonies; and tribes in the Seven Years War in America ,Francis Jennings,0393025373;9780393306408,Norton,1988
e175 ttt,e1000,E175 TTT,E1000,Telling the truth about history ,Joyce Oldham Apple ; with Lynn Hunt and Margaret Jacob,0393312860,Norton,1994
e169cyd,e100,E169CYD,E100,"Commodify your dissent : salvos from ""The Baffler"" ",edited  Thomas Frank and Matt Weiland,0393316734,WWNorton,1997
e185st,e100,E185ST,E100,Sojourner Truth : a life; a symbol ,Nell Irvin Painter,0393317080;0393027392,WW Norton,1996
e185st,e100,E185ST,E100,Sojourner Truth : a life; a symbol ,Nell Irvin Painter,0393317080;0393027392,WW Norton,1996
e184jft,e100,E184JFT,E100,Journey from the land of no : a girlhood caught in revolutiory Iran ,Roya Hakakian,0609810308,Hi Marketing distributor; Random House,2006
e221 ia,e2000,E221 IA,E2000,Inventing America : Jefferson's Declaration of Independence ,Garry Wills,9780618257768;0618257764,Houghton Mifflin Co,2002
e841 ts,e8000,E841 TS,E8000,The sixties : years of hope; days of rage ,Todd Gitlin,0553372122,Bantam Books,1993
e841 ooo,e8000,E841 OOO,E8000,On our own : Americans in the sixties ,Douglas T Miller,0669247774;9780669247770,DC Heath,1996
e185ptw,e100,E185PTW,E100,Parting the waters : America in the King years; 1954-63 ,Taylor Branch,9780671687427;0671687425,Simon and Schuster,1989
e208 for,e2000,E208 FOR,E2000,Faces of revolution : persolities and themes in the struggle for American independence ,Bernard Bailyn,0679736239,Vintage Books,1992
e209 tro,e2000,E209 TRO,E2000,The radicalism of the American Revolution ,Gordon S Wood,0679736883,Vintage Books,1993
e197 tuc,e1000,E197 TUC,E1000,The unredeemed captive : a family story from early America ,John Demos,0679759611,Vintage Books,1995
e159 laa,e1000,E159 LAA,E1000,Lies across America : what our historic sites get wrong ,James W Loewen,9780743296298;074329629X,Simon & Schuster,2000
e184aa,e100,E184AA,E100,Asian Americans : an interpretive history ,Sucheng Chan,0805784268;0805784373,Twayne,1991
e185tmd,e100,E185TMD,E100,The Memphis diary of Ida B. Wells ,edited  Miriam DeCosta-Willis ; foreword  Mary Helen Washington ; afterword  Dorothy Sterling,0807070645;0807070653,Beacon P,1995
e175ycb,e100,E175YCB,E100,You can't be neutral on a moving train : a persol history of our times ,Howard Zinn,9780807071274;0807071277,Beacon Press,2002
e162 tic,e1000,E162 TIC,E1000,The intellectual construction of America : exceptiolism and identity from 1492 to 1800 ,Jack P Greene,0807820970;9780807820971;0807846317;9780807846315,U of North Caroli P,1993
e185 fpt,e1000,E185 FPT,E1000,From plantation to ghetto ,August Meier and Elliott Rudwick,0809047926;9780809047925;0809001225;9780809001224,Hill & Wang,1976
e179md,e100,E179MD,E100,Manifest destiny : American expansionism and the empire of right ,Anders Stephanson,0809015846;9780809015849,Hill and Wang,1995
e185ttt,e100,E185TTT,E100,To tell the truth freely : the life of Ida B. Wells ,Mia Bay,9780809016464;080901646X,Hill and Wang,2009
e208 tar,e2000,E208 TAR,E2000,The American revolution ,Edward Countryman,9780809025626;0809025620,Hill and Wang,2003
e215tsa,e200,E215TSA,E200,The shoemaker and the tea party : memory and the American Revolution ,Alfred F Young,0807071404;9780807071403;0807054054;9780807054055,Beacon Press,1999
e178 ata,e1000,E178 ATA,E1000,A tion among tions : America's place in world history ,Thomas Bender,9780809072354;0809072351,Hill and Wang,2006
e741 aia,e7000,E741 AIA,E7000,Ain't I a woman : Black women and feminism ,Marty Jezer,0896081273;0896081281,South End Press,1981
e185tpc,e100,E185TPC,E100,The Pan-African connection : from slavery to Garvey and beyond ,Tony Martin,9780912469119;0912469110,Majority Press,1984
e185bf,e100,E185BF,E100,Black foremothers : three lives ,Dorothy Sterling ; foreword  Margaret Walker ; introduction  Barbara Christian,9780935312898;0935312897,Feminist P,1988
e185tlc,e100,E185TLC,E100,The last crusade : Martin Luther King Jr; the FBI and the Poor People's Campaign ,Gerald D McKnight,9780813333847;0813333849,Westview Press,1998
